{
  "schema": "sdd-text-view-projection",
  "version": "0.2",
  "view_id": "journey_map",
  "source_example": "outcome_to_ia_trace",
  "nodes": [
    {
      "id": "G-001",
      "type": "Stage",
      "name": "Checkout"
    },
    {
      "id": "J-001",
      "type": "JourneyStep",
      "name": "Enter Billing"
    },
    {
      "id": "J-002",
      "type": "JourneyStep",
      "name": "Confirm Payment"
    }
  ],
  "edges": [
    {
      "from": "G-001",
      "type": "CONTAINS",
      "to": "J-001"
    },
    {
      "from": "G-001",
      "type": "CONTAINS",
      "to": "J-002"
    },
    {
      "from": "J-001",
      "type": "PRECEDES",
      "to": "J-002"
    }
  ],
  "derived": {
    "node_annotations": [
      {
        "node_id": "J-001",
        "references": [
          {
            "role": "opportunity_ref",
            "target_id": "OP-001",
            "target_type": "Opportunity",
            "target_name": "Payment Friction",
            "source_prop": "opportunity_refs"
          }
        ]
      }
    ],
    "edge_annotations": [],
    "node_groups": [],
    "view_metadata": {}
  },
  "omissions": [],
  "notes": [
    "Opportunity references are rendered as step annotations driven by JourneyStep.props.opportunity_refs."
  ]
}
