{
  "schema": "sdd-text-view-projection",
  "version": "0.2",
  "view_id": "outcome_opportunity_map",
  "source_example": "outcome_to_ia_trace",
  "nodes": [
    {
      "id": "I-001",
      "type": "Initiative",
      "name": "Billing Simplification"
    },
    {
      "id": "M-001",
      "type": "Metric",
      "name": "Checkout Completion Rate"
    },
    {
      "id": "O-001",
      "type": "Outcome",
      "name": "Reduce Abandonment"
    },
    {
      "id": "OP-001",
      "type": "Opportunity",
      "name": "Payment Friction"
    }
  ],
  "edges": [
    {
      "from": "I-001",
      "type": "ADDRESSES",
      "to": "OP-001"
    },
    {
      "from": "O-001",
      "type": "MEASURED_BY",
      "to": "M-001"
    },
    {
      "from": "OP-001",
      "type": "SUPPORTS",
      "to": "O-001"
    }
  ],
  "derived": {
    "node_annotations": [
      {
        "node_id": "I-001",
        "references": [
          {
            "role": "implemented_by",
            "target_id": "P-001",
            "target_type": "Place",
            "target_name": "Billing"
          }
        ]
      },
      {
        "node_id": "M-001",
        "references": [
          {
            "role": "instrumented_at",
            "group": "experience",
            "target_id": "J-002",
            "target_type": "JourneyStep",
            "target_name": "Confirm Payment"
          },
          {
            "role": "instrumented_at",
            "group": "event",
            "target_id": "E-001",
            "target_type": "Event",
            "target_name": "Payment Submitted"
          }
        ]
      }
    ],
    "edge_annotations": [],
    "node_groups": [],
    "view_metadata": {}
  },
  "omissions": [
    {
      "kind": "edge",
      "from": "I-001",
      "type": "IMPLEMENTED_BY",
      "to": "P-001",
      "reason": "derived_annotation_instead_of_edge",
      "detail": "Rendered as an implementation annotation because the target node type Place is outside the view node scope."
    },
    {
      "kind": "edge",
      "from": "M-001",
      "type": "INSTRUMENTED_AT",
      "to": "E-001",
      "reason": "derived_annotation_instead_of_edge",
      "detail": "Rendered as an event-group metric annotation because the target node type Event is outside the view node scope."
    },
    {
      "kind": "edge",
      "from": "M-001",
      "type": "INSTRUMENTED_AT",
      "to": "J-002",
      "reason": "derived_annotation_instead_of_edge",
      "detail": "Rendered as an experience-group metric annotation because the target node type JourneyStep is outside the view node scope."
    }
  ],
  "notes": []
}
