{
  "schema": "sdd-text-view-projection",
  "version": "0.2",
  "view_id": "service_blueprint",
  "source_example": "service_blueprint_slice",
  "nodes": [
    {
      "id": "BP-020",
      "type": "BlueprintStep",
      "name": "Submit Claim"
    },
    {
      "id": "BP-021",
      "type": "BlueprintStep",
      "name": "Receive Confirmation"
    },
    {
      "id": "D-020",
      "type": "DataEntity",
      "name": "Claim"
    },
    {
      "id": "PL-020",
      "type": "Policy",
      "name": "Retention Policy"
    },
    {
      "id": "PR-020",
      "type": "Process",
      "name": "Validate Claim"
    },
    {
      "id": "PR-021",
      "type": "Process",
      "name": "Review Claim History"
    },
    {
      "id": "PR-022",
      "type": "Process",
      "name": "Notify Customer"
    },
    {
      "id": "SA-020",
      "type": "SystemAction",
      "name": "Store Claim"
    },
    {
      "id": "SA-021",
      "type": "SystemAction",
      "name": "Load Claim History"
    },
    {
      "id": "SA-022",
      "type": "SystemAction",
      "name": "Send Email"
    }
  ],
  "edges": [
    {
      "from": "BP-020",
      "type": "PRECEDES",
      "to": "BP-021"
    },
    {
      "from": "BP-020",
      "type": "REALIZED_BY",
      "to": "PR-020"
    },
    {
      "from": "BP-021",
      "type": "REALIZED_BY",
      "to": "PR-022"
    },
    {
      "from": "PR-020",
      "type": "CONSTRAINED_BY",
      "to": "PL-020"
    },
    {
      "from": "PR-020",
      "type": "DEPENDS_ON",
      "to": "SA-020"
    },
    {
      "from": "PR-020",
      "type": "PRECEDES",
      "to": "PR-021"
    },
    {
      "from": "PR-021",
      "type": "DEPENDS_ON",
      "to": "SA-021"
    },
    {
      "from": "PR-021",
      "type": "PRECEDES",
      "to": "PR-022"
    },
    {
      "from": "PR-022",
      "type": "DEPENDS_ON",
      "to": "SA-022"
    },
    {
      "from": "SA-020",
      "type": "CONSTRAINED_BY",
      "to": "PL-020"
    },
    {
      "from": "SA-020",
      "type": "READS",
      "to": "D-020"
    },
    {
      "from": "SA-020",
      "type": "WRITES",
      "to": "D-020"
    },
    {
      "from": "SA-021",
      "type": "READS",
      "to": "D-020"
    },
    {
      "from": "SA-022",
      "type": "READS",
      "to": "D-020"
    }
  ],
  "derived": {
    "node_annotations": [],
    "edge_annotations": [],
    "node_groups": [
      {
        "id": "lane:01:customer",
        "role": "lane",
        "label": "customer",
        "node_ids": [
          "BP-020",
          "BP-021"
        ]
      },
      {
        "id": "lane:02:frontstage",
        "role": "lane",
        "label": "frontstage",
        "node_ids": [
          "PR-020"
        ]
      },
      {
        "id": "lane:03:backstage",
        "role": "lane",
        "label": "backstage",
        "node_ids": [
          "PR-021"
        ]
      },
      {
        "id": "lane:04:support",
        "role": "lane",
        "label": "support",
        "node_ids": [
          "PR-022"
        ]
      },
      {
        "id": "lane:05:system",
        "role": "lane",
        "label": "system",
        "node_ids": [
          "D-020",
          "SA-020",
          "SA-021",
          "SA-022"
        ]
      },
      {
        "id": "lane:06:policy",
        "role": "lane",
        "label": "policy",
        "node_ids": [
          "PL-020"
        ]
      }
    ],
    "view_metadata": {}
  },
  "omissions": [
    {
      "kind": "edge",
      "from": "PR-022",
      "type": "EMITS",
      "to": "E-020",
      "reason": "endpoint_out_of_scope",
      "detail": "Target node type Event is outside the service_blueprint node scope."
    }
  ],
  "notes": []
}
